{"ble":{"partition_name":"app_a","sha256":"afd74369c49f8e2a5526f18be5e7965763a0651c7e8ed1027f7e8e1ffed464fd","size":1447378,"url":"https://github.com/onemira-space/onemira-updates/releases/download/bundle-v2026.10.16.1/OneMira-Firmware-BH1098-1.1.62-BLE-OTA.bin"},"chip":"BH1098","hardware_revisions":["C1","BH1098S-C1"],"minimum_current_version":"1.1.11","product":"mira-context","published_at":"2026-10-16T04:49:18Z","release_notes":"OneMira C1 1.1.62 adds an optional host-selected live BLE audio profile for Windows on 27- and 80-octet links, preserves legacy macOS START behavior when the selector is absent, and retains the unacknowledged live tail for TF backfill after Stop. Low-voltage battery hardware validation remains unvalidated; this release is authorized for real-device power/recording evidence only.","schema_version":2,"usb":{"format":"bh1098-partition-zip","handoff":"application-mbc1-usb-app-ota-v1","opcode":"mbc1","partition_strategy":"inactive-application-slot","sha256":"7f8a9a26dce41fe83d2a64f4cbf1ba1329b8997346294a8211c8a1d1610b09eb","size":2177948,"url":"https://github.com/onemira-space/onemira-updates/releases/download/bundle-v2026.10.16.1/OneMira-Firmware-BH1098-1.1.62-USB-OTA.zip"},"version":"1.1.62"}
