{"ble":{"partition_name":"app_a","sha256":"44a179648c31a57aa0113be073c834c47cedd3a12699cdc19b5635f3b8e7ca4e","size":1444930,"url":"https://github.com/onemira-space/onemira-updates/releases/download/firmware-test-v1.1.61-8eef7ba8221d/OneMira-Test-Firmware-BH1098-1.1.61-BLE-OTA.bin"},"chip":"BH1098","hardware_revisions":["C1","BH1098S-C1"],"minimum_current_version":"1.1.11","product":"mira-context","published_at":"2026-09-22T04:08:09Z","release_notes":"Test OTA 1.1.61: Application-only test OTA. Stable feed unchanged. Source 8eef7ba8221d301f4f56f8e5c82ff03d1e2cb48d.","schema_version":2,"usb":{"format":"bh1098-partition-zip","handoff":"application-mbc1-usb-app-ota-v1","opcode":"mbc1","partition_strategy":"inactive-application-slot","sha256":"5a5dd5143cc310f5b7a91b8767b0758b4e48a3f990032ae1c21f7f13a853b4de","size":2174416,"url":"https://github.com/onemira-space/onemira-updates/releases/download/firmware-test-v1.1.61-8eef7ba8221d/OneMira-Test-Firmware-BH1098-1.1.61-USB-OTA.zip"},"version":"1.1.61"}
